{
  "schema": "vvh.script-pack.v1",
  "status": "text-only-not-audio-pack",
  "note": "Original translated recording/TTS scripts. No synthesized or recorded audio is bundled; TTS pronunciation and translation require human review.",
  "semantics": [
    "clean.start",
    "clean.pause",
    "clean.complete",
    "dock.return.charge",
    "dock.charging",
    "battery.low",
    "error.main_brush",
    "error.side_brush",
    "error.robot_trapped",
    "error.filter",
    "error.generic",
    "locate.here",
    "network.connected",
    "network.failed",
    "clean.room.start",
    "clean.zone.start"
  ],
  "locales": {
    "ar": {
      "name": "العربية",
      "phrases": {
        "clean.start": "بدء التنظيف.",
        "clean.pause": "تم إيقاف التنظيف مؤقتًا.",
        "clean.complete": "اكتمل التنظيف.",
        "dock.return.charge": "العودة إلى قاعدة الشحن.",
        "dock.charging": "جارٍ الشحن.",
        "battery.low": "مستوى البطارية منخفض.",
        "error.main_brush": "الفرشاة الرئيسية عالقة. يُرجى تنظيفها.",
        "error.side_brush": "الفرشاة الجانبية عالقة. يُرجى تنظيفها.",
        "error.robot_trapped": "الروبوت عالق. يُرجى إزالة العائق.",
        "error.filter": "يُرجى فحص الفلتر وتنظيفه.",
        "error.generic": "حدث خطأ. يُرجى فحص المكنسة الروبوتية.",
        "locate.here": "أنا هنا.",
        "network.connected": "تم الاتصال بالشبكة.",
        "network.failed": "فشل الاتصال بالشبكة.",
        "clean.room.start": "بدء تنظيف الغرفة.",
        "clean.zone.start": "بدء تنظيف المنطقة المحددة."
      }
    },
    "cs": {
      "name": "Čeština",
      "phrases": {
        "clean.start": "Spouštím úklid.",
        "clean.pause": "Úklid pozastaven.",
        "clean.complete": "Úklid dokončen.",
        "dock.return.charge": "Vracím se do nabíjecí stanice.",
        "dock.charging": "Probíhá nabíjení.",
        "battery.low": "Nízký stav baterie.",
        "error.main_brush": "Hlavní kartáč je zablokovaný. Vyčistěte jej.",
        "error.side_brush": "Boční kartáč je zablokovaný. Vyčistěte jej.",
        "error.robot_trapped": "Robot uvízl. Odstraňte překážku.",
        "error.filter": "Zkontrolujte a vyčistěte filtr.",
        "error.generic": "Došlo k chybě. Zkontrolujte robota.",
        "locate.here": "Jsem tady.",
        "network.connected": "Připojení k síti bylo úspěšné.",
        "network.failed": "Připojení k síti se nezdařilo.",
        "clean.room.start": "Spouštím úklid místnosti.",
        "clean.zone.start": "Spouštím úklid zóny."
      }
    },
    "de": {
      "name": "Deutsch",
      "phrases": {
        "clean.start": "Reinigung wird gestartet.",
        "clean.pause": "Reinigung pausiert.",
        "clean.complete": "Reinigung abgeschlossen.",
        "dock.return.charge": "Ich fahre zur Ladestation zurück.",
        "dock.charging": "Akku wird geladen.",
        "battery.low": "Akkustand niedrig.",
        "error.main_brush": "Die Hauptbürste ist blockiert. Bitte reinigen.",
        "error.side_brush": "Die Seitenbürste ist blockiert. Bitte reinigen.",
        "error.robot_trapped": "Der Roboter steckt fest. Bitte Hindernis entfernen.",
        "error.filter": "Bitte Filter prüfen und reinigen.",
        "error.generic": "Ein Fehler ist aufgetreten. Bitte Roboter prüfen.",
        "locate.here": "Ich bin hier.",
        "network.connected": "Mit dem Netzwerk verbunden.",
        "network.failed": "Netzwerkverbindung fehlgeschlagen.",
        "clean.room.start": "Zimmerreinigung wird gestartet.",
        "clean.zone.start": "Zonenreinigung wird gestartet."
      }
    },
    "en": {
      "name": "English",
      "phrases": {
        "clean.start": "Starting cleaning.",
        "clean.pause": "Cleaning paused.",
        "clean.complete": "Cleaning complete.",
        "dock.return.charge": "Returning to the charging dock.",
        "dock.charging": "Charging.",
        "battery.low": "Battery is low.",
        "error.main_brush": "Main brush is blocked. Please clean it.",
        "error.side_brush": "Side brush is blocked. Please clean it.",
        "error.robot_trapped": "The robot is stuck. Please remove the obstacle.",
        "error.filter": "Please check and clean the filter.",
        "error.generic": "An error occurred. Please check the robot.",
        "locate.here": "I am here.",
        "network.connected": "Connected to the network.",
        "network.failed": "Network connection failed.",
        "clean.room.start": "Starting room cleaning.",
        "clean.zone.start": "Starting zone cleaning."
      }
    },
    "es": {
      "name": "Español",
      "phrases": {
        "clean.start": "Iniciando la limpieza.",
        "clean.pause": "Limpieza en pausa.",
        "clean.complete": "Limpieza finalizada.",
        "dock.return.charge": "Regresando a la base de carga.",
        "dock.charging": "Cargando la batería.",
        "battery.low": "Batería baja.",
        "error.main_brush": "El cepillo principal está bloqueado. Límpielo.",
        "error.side_brush": "El cepillo lateral está bloqueado. Límpielo.",
        "error.robot_trapped": "El robot está atascado. Retire el obstáculo.",
        "error.filter": "Revise y limpie el filtro.",
        "error.generic": "Se ha producido un error. Revise el robot.",
        "locate.here": "Estoy aquí.",
        "network.connected": "Conexión a la red establecida.",
        "network.failed": "Error de conexión a la red.",
        "clean.room.start": "Iniciando limpieza de habitación.",
        "clean.zone.start": "Iniciando limpieza de zona."
      }
    },
    "fr": {
      "name": "Français",
      "phrases": {
        "clean.start": "Démarrage du nettoyage.",
        "clean.pause": "Nettoyage en pause.",
        "clean.complete": "Nettoyage terminé.",
        "dock.return.charge": "Retour à la station de charge.",
        "dock.charging": "Batterie en charge.",
        "battery.low": "Batterie faible.",
        "error.main_brush": "La brosse principale est bloquée. Veuillez la nettoyer.",
        "error.side_brush": "La brosse latérale est bloquée. Veuillez la nettoyer.",
        "error.robot_trapped": "Le robot est coincé. Retirez l’obstacle.",
        "error.filter": "Veuillez vérifier et nettoyer le filtre.",
        "error.generic": "Une erreur est survenue. Vérifiez le robot.",
        "locate.here": "Je suis ici.",
        "network.connected": "Connexion au réseau réussie.",
        "network.failed": "Échec de la connexion au réseau.",
        "clean.room.start": "Démarrage du nettoyage de la pièce.",
        "clean.zone.start": "Démarrage du nettoyage de la zone."
      }
    },
    "hi": {
      "name": "हिन्दी",
      "phrases": {
        "clean.start": "सफ़ाई शुरू हो रही है।",
        "clean.pause": "सफ़ाई रोक दी गई है।",
        "clean.complete": "सफ़ाई पूरी हो गई है।",
        "dock.return.charge": "चार्जिंग स्टेशन पर लौट रहा हूँ।",
        "dock.charging": "चार्ज हो रहा है।",
        "battery.low": "बैटरी कम है।",
        "error.main_brush": "मुख्य ब्रश फँस गया है। कृपया इसे साफ़ करें।",
        "error.side_brush": "साइड ब्रश फँस गया है। कृपया इसे साफ़ करें।",
        "error.robot_trapped": "रोबोट फँस गया है। कृपया रास्ता साफ़ करें।",
        "error.filter": "कृपया फ़िल्टर जाँचें और साफ़ करें।",
        "error.generic": "त्रुटि हुई है। कृपया रोबोट वैक्यूम की जाँच करें।",
        "locate.here": "मैं यहाँ हूँ।",
        "network.connected": "नेटवर्क से जुड़ गया हूँ।",
        "network.failed": "नेटवर्क से कनेक्शन विफल रहा।",
        "clean.room.start": "कमरे की सफ़ाई शुरू हो रही है।",
        "clean.zone.start": "चुने हुए क्षेत्र की सफ़ाई शुरू हो रही है।"
      }
    },
    "hu": {
      "name": "Magyar",
      "phrases": {
        "clean.start": "Takarítás indítása.",
        "clean.pause": "Takarítás szüneteltetve.",
        "clean.complete": "Takarítás befejezve.",
        "dock.return.charge": "Visszatérek a töltőállomásra.",
        "dock.charging": "Töltés folyamatban.",
        "battery.low": "Alacsony akkumulátorszint.",
        "error.main_brush": "A főkefe elakadt. Kérjük, tisztítsa meg.",
        "error.side_brush": "Az oldalkefe elakadt. Kérjük, tisztítsa meg.",
        "error.robot_trapped": "A robot elakadt. Távolítsa el az akadályt.",
        "error.filter": "Ellenőrizze és tisztítsa meg a szűrőt.",
        "error.generic": "Hiba történt. Ellenőrizze a robotot.",
        "locate.here": "Itt vagyok.",
        "network.connected": "Sikeres hálózati kapcsolat.",
        "network.failed": "Nem sikerült csatlakozni a hálózathoz.",
        "clean.room.start": "Szobatakarítás indítása.",
        "clean.zone.start": "Zónatakarítás indítása."
      }
    },
    "id": {
      "name": "Bahasa Indonesia",
      "phrases": {
        "clean.start": "Mulai membersihkan.",
        "clean.pause": "Pembersihan dijeda.",
        "clean.complete": "Pembersihan selesai.",
        "dock.return.charge": "Kembali ke dok pengisian daya.",
        "dock.charging": "Sedang mengisi daya.",
        "battery.low": "Baterai lemah.",
        "error.main_brush": "Sikat utama tersangkut. Harap bersihkan.",
        "error.side_brush": "Sikat samping tersangkut. Harap bersihkan.",
        "error.robot_trapped": "Robot terjebak. Singkirkan penghalangnya.",
        "error.filter": "Periksa dan bersihkan filter.",
        "error.generic": "Terjadi kesalahan. Periksa robot penyedot debu.",
        "locate.here": "Saya di sini.",
        "network.connected": "Terhubung ke jaringan.",
        "network.failed": "Gagal terhubung ke jaringan.",
        "clean.room.start": "Mulai membersihkan ruangan.",
        "clean.zone.start": "Mulai membersihkan area yang dipilih."
      }
    },
    "it": {
      "name": "Italiano",
      "phrases": {
        "clean.start": "Avvio della pulizia.",
        "clean.pause": "Pulizia in pausa.",
        "clean.complete": "Pulizia completata.",
        "dock.return.charge": "Ritorno alla base di ricarica.",
        "dock.charging": "Batteria in carica.",
        "battery.low": "Batteria scarica.",